{
  "version": "1.2.0",
  "colors": {
    "background": "#FFFFFF",
    "surface": "#FFFFFF",
    "foreground": "#0B1A33",
    "muted": "#F3F8FC",
    "mutedForeground": "#3A4D63",
    "border": "#C0C8D0",
    "brand": "#0B1A33",
    "brandForeground": "#FFFFFF",
    "dominant": "#FFFFFF",
    "dominantForeground": "#0B1A33",
    "secondary": "#F3F8FC",
    "secondaryForeground": "#0B1A33",
    "accent": "#0090F8",
    "accentForeground": "#FFFFFF",
    "destructive": "#F80000",
    "focus": "#0090F8",
    "cyan": "#40D0F8",
    "silver": "#C0C8D0",
    "safety": "#F8D078",
    "glow": "#E8F6FE"
  },
  "typography": {
    "fontFamily": {
      "sans": "Inter, Arial, Helvetica, sans-serif",
      "display": "Inter, Arial, Helvetica, sans-serif"
    },
    "fontSize": {
      "xs": "0.75rem",
      "sm": "0.875rem",
      "base": "1rem",
      "lg": "1.125rem",
      "xl": "1.25rem",
      "2xl": "1.5rem",
      "3xl": "1.875rem",
      "4xl": "2.25rem",
      "5xl": "3rem",
      "6xl": "3.75rem"
    },
    "fontWeight": {
      "regular": 400,
      "medium": 500,
      "semibold": 600,
      "bold": 700
    },
    "lineHeight": {
      "tight": 1.1,
      "snug": 1.25,
      "normal": 1.5,
      "relaxed": 1.7
    },
    "letterSpacing": {
      "tight": "-0.025em",
      "normal": "0em",
      "wide": "0.08em"
    }
  },
  "spacing": {
    "0": "0px",
    "1": "0.25rem",
    "2": "0.5rem",
    "3": "0.75rem",
    "4": "1rem",
    "5": "1.25rem",
    "6": "1.5rem",
    "8": "2rem",
    "10": "2.5rem",
    "12": "3rem",
    "16": "4rem",
    "20": "5rem",
    "24": "6rem",
    "32": "8rem"
  },
  "radii": {
    "none": "0px",
    "sm": "0.375rem",
    "md": "0.75rem",
    "lg": "1.25rem",
    "xl": "1.75rem",
    "full": "9999px"
  },
  "shadows": {
    "sm": "0 1px 2px rgb(0 0 0 / 0.06)",
    "md": "0 8px 24px rgb(0 0 0 / 0.08)",
    "lg": "0 20px 50px rgb(0 0 0 / 0.12)",
    "glow": "0 10px 24px rgb(0 144 248 / 0.25)"
  },
  "motion": {
    "duration": {
      "fast": "120ms",
      "normal": "200ms",
      "slow": "500ms",
      "reduced": "0.01ms"
    },
    "easing": {
      "standard": "cubic-bezier(0.2, 0, 0, 1)",
      "emphasized": "cubic-bezier(0.2, 0, 0, 1.2)"
    }
  },
  "breakpoints": {
    "xs": "320px",
    "sm": "640px",
    "md": "768px",
    "lg": "1024px",
    "xl": "1280px",
    "2xl": "1536px"
  }
}
